{
  "$schema": "http://json-schema.org/draft-07/schema#",
  "title": "Story",
  "version": "1.0.0",
  "type": "object",
  "required": ["id", "title", "description"],
  "properties": {
    "id": { "type": "string", "pattern": "^[a-z0-9-]{3,32}$" },
    "title": { "type": "string", "minLength": 3, "maxLength": 80 },
    "description": { "type": "string", "minLength": 10, "maxLength": 300 },
    "relatedCollections": { "type": "array", "items": { "type": "string" } },
    "relatedExperiences": { "type": "array", "items": { "type": "string" } },
    "narrative": { "type": "string" },
    "version": { "type": "string", "default": "1.0.0" }
  },
  "additionalProperties": false
}
